{
  "batch_id": "BL-REPLAY-PROCESS-BOUNDS-F005",
  "fix_round": 0,
  "created_at": "2026-10-08T04:01:20.000Z",
  "waiting": null,
  "verdicts": [
    {
      "feature_id": "F001",
      "result": "PASS",
      "evidence": "Fresh Kimi evaluator probes at verified HEAD 3130cef3bc55528290c49ee35267e1aff33b5c78 (docs/test-reports/BL-REPLAY-PROCESS-BOUNDS-kimi-20261008/f001-probe.log): 11/11 independent controls pass. SIGTERM-resistant child -> BoundedSubprocessTimeoutError at 538ms (500ms budget + 2000ms declared allowance), owned group reaped, 0 live. SIGTERM-resistant descendant retaining inherited pipes -> timeout at 559ms, no close-hang, both owned processes reaped. Output overflow -> BoundedSubprocessOutputError with no EV-RAW-STDERR-CANARY-KIMI in error, child reaped; combined stdout+stderr charged to one budget (1024 refuses / 1400 passes exactly). Worker killed 300ms AFTER publishing owned child PID -> BoundedSubprocessSupervisionError, no worker canary leak, published group SIGKILLed (mid-flight supervision path beyond Generator coverage). Missing executable and missing target cwd -> BoundedSubprocessLaunchError (cwd case code ENOENT, distinct from supervision failure). Invalid budgets (0/-1/NaN/Infinity/0.5/2^32) -> RangeError pre-spawn, zero new spawns. Nonzero exit 17 preserved distinctly; SIGTERM signal preserved. Focused suite tests/cli/process-bounds/bounded-subprocess.test.ts also green in my focused run (focused.log).",
      "steps_to_reproduce": "cd <worktree at 3130cef>; export PATH=/Users/yixingzhou/.nvm/versions/node/v22.22.0/bin:$PATH; npm ci; R=/private/tmp/tk-ev-f001b; mkdir -p $R/home $R/tmp $R/root; env -i PATH=\"$PATH\" HOME=$R/home USERPROFILE=$R/home TMPDIR=$R/tmp EV_ROOT=$R/root EV_REPO=\"$PWD\" node docs/test-reports/BL-REPLAY-PROCESS-BOUNDS-kimi-20261008/probes/ev-watchdog.mjs 60000 $R/root/pids -- node --import tsx docs/test-reports/BL-REPLAY-PROCESS-BOUNDS-kimi-20261008/probes/probe-f001.mjs"
    },
    {
      "feature_id": "F002",
      "result": "PASS",
      "evidence": "Independent probe f002-probe.log: 7/7 controls pass against a synthetic install tree with real product bytes and evaluator's own PATH-first git shim, fresh process per mode. Stalled SIGTERM-resistant git -> getAgentVersion() null in 2198ms (within 2000ms budget + 2000ms declared POSIX allowance; ceiling 4500ms). Overflow (256KiB vs 128-byte cap), invalid SHA, short SHA, nonzero exit, signal exit -> null, each <=149ms, no partial SHA. Healthy control reports the exact 12-hex install checkout SHA (e76833db9dcf); after advancing the on-disk checkout post-import, the imported module still returns the startup SHA while disk shows 4f7bfcddaa8c (snapshot frozen at import; no later disk reread). Generator's agent-version-bounds focused tests also green in my focused run.",
      "steps_to_reproduce": "cd <worktree at 3130cef>; export PATH=/Users/yixingzhou/.nvm/versions/node/v22.22.0/bin:$PATH; npm ci; R=/private/tmp/tk-ev-f002c; mkdir -p $R/home $R/tmp $R/root; env -i PATH=\"$PATH\" HOME=$R/home USERPROFILE=$R/home TMPDIR=$R/tmp EV_ROOT=$R/root EV_REPO=\"$PWD\" EV_REAL_GIT=\"$(which git)\" node docs/test-reports/BL-REPLAY-PROCESS-BOUNDS-kimi-20261008/probes/ev-watchdog.mjs 90000 $R/root/pids -- node --import tsx docs/test-reports/BL-REPLAY-PROCESS-BOUNDS-kimi-20261008/probes/probe-f002.mjs"
    },
    {
      "feature_id": "F003",
      "result": "PASS",
      "evidence": "Independent probe f003-probe.log: 6/6 controls pass with explicit synthetic queue/cursor/config and byte comparison around every refusal; each replay invocation in a fresh child process. Stalled SIGTERM-resistant git tree + pipe-holding descendant refuses PREVIEW: 'Replay refused: Git enrichment exceeded 10000ms deadline' at 8039ms (<10000), queue/cursor/config byte-identical, 2 tracked owned processes then 0 live, no raw canary in error. Same tree refuses EXECUTE with a VALID confirmation digest from a healthy preview: refusal at 8037ms, all state byte-identical, 0 live owned. Shared operation deadline: 2.5s/call shim over a real repo -> refusal at 8043ms after 4 sequential git invocations (no per-call renewal). Overflowing git -> 'Replay refused: Git enrichment could not complete safely' without EV-RAW-GIT-CANARY-KIMI. Healthy end-to-end: preview read-only; confirmed execute admits exactly 1 minimized event with 40-hex gitCommit; credential remote normalized to https://git.example/team/ev-fixture.git; queue free of message canary/token/username; cursor/config untouched. Ordinary absent-git (non-repo) enrichment still works (ws1 control). Queue-lock late-failure guard verified structurally (src/cli/queue.ts:66 beforeMutate inside withFileLock; src/cli/replay.ts:388-394 remaining-deadline options) and dynamically via retained QUEUE_LOCK_GUARD case in my focused run. Retained f003-probe-v1-cache-poisoned.log documents an evaluator probe bug (same-process healthy-then-stalled on one workspace hit the documented per-process GitInfo cache at src/cli/git.ts:15), corrected by fresh-process isolation in v2; not a product defect.",
      "steps_to_reproduce": "cd <worktree at 3130cef>; export PATH=/Users/yixingzhou/.nvm/versions/node/v22.22.0/bin:$PATH; npm ci; R=/private/tmp/tk-ev-f003b; mkdir -p $R/home $R/tmp $R/root; env -i PATH=\"$PATH\" HOME=$R/home USERPROFILE=$R/home TMPDIR=$R/tmp EV_ROOT=$R/root EV_REPO=\"$PWD\" EV_REAL_GIT=\"$(which git)\" node docs/test-reports/BL-REPLAY-PROCESS-BOUNDS-kimi-20261008/probes/ev-watchdog.mjs 150000 $R/root/pids -- node --import tsx docs/test-reports/BL-REPLAY-PROCESS-BOUNDS-kimi-20261008/probes/probe-f003.mjs"
    },
    {
      "feature_id": "F004",
      "result": "PASS",
      "evidence": "Independent reruns at 3130cef: fresh npm ci exit 0 (670 pkgs, no shared node_modules); npm run lint exit 0; npm run verify exit 0; npm run build exit 0 (build.log, BUILD_EXIT=0). Focused 23-file suite (process-bounds + replay/privacy/queue/B03/B07/collect/git): 189 passed / 6 skipped exit 0 (focused.log). Full DEFAULT run: 1919 passed / 34 skipped exit 0 (full-default.log); full CONTROLLED run (--maxWorkers=1 --no-file-parallelism), executed separately: 1919 passed / 34 skipped exit 0 (full-controlled.log) — counts match Generator claims. Frozen-input inventory rerun: input-inventory.json shows 1277 pre-existing tracked tests/reports byte-identical to ba292a0, 0 altered, 18 new source/test/fixture paths. Product diff vs ba292a0 confined to the 5 allowed files; F004 commit 3130cef touches no product files. Independent baseline F1 repro on exact ba292a0 bytes (f004-baseline-startup-repro.log): real ba292a0 agent-version.ts (inspection: execFileSync with no timeout/cap) under evaluator's stalled SIGTERM-resistant git shim hung module load past the 5000ms external watchdog; watchdog SIGKILLed its own probe group and backstopped only pid-file-owned fixture processes; no stray processes afterward. Baseline F2 mechanism confirmed by inspection (ba292a0 git.ts: sync timeout sends SIGTERM, no group/tree kill) plus empirically proven shim SIGTERM resistance; Generator's heavyweight baseline replay repro (baseline-reproduction.log) not rerun (time-boxed), treated as corroboration only. Windows-only tests remain explicit macOS skips (6 skipped), not inferred PASS. Probe-v1 failure logs retained (f001-probe-v1-probe-bug.log, f003-probe-v1-cache-poisoned.log) — evaluator-side bugs, corrected and passed in v2; no product failure hidden.",
      "steps_to_reproduce": "cd <worktree at 3130cef>; export PATH=/Users/yixingzhou/.nvm/versions/node/v22.22.0/bin:$PATH; npm ci && npm run lint && npm run verify && npm run build; env -i HOME=/private/tmp/x USERPROFILE=/private/tmp/x TMPDIR=/private/tmp/y PATH=\"$PATH\" npx vitest run; then same env with npx vitest run --maxWorkers=1 --no-file-parallelism; node tests/fixtures/process-bounds/inventory.mjs out.json; baseline repro: git show ba292a0:src/cli/agent-version.ts > $R/install/src/cli/agent-version.ts with evaluator git shim (EV_GIT_MODE=stall) first on PATH, run under probes/ev-watchdog.mjs 5000 and observe watchdog SIGKILL at ~5013ms."
    },
    {
      "feature_id": "F005",
      "result": "PASS",
      "evidence": "This fresh Kimi-family evaluation performed F005 itself: verified repo.ref SHA 3130cef3bc55528290c49ee35267e1aff33b5c78 matches HEAD; read spec/evaluator.md/progress from disk; treated Generator/historical reports as claims; independently derived and ran real-subprocess adversarial controls for SIGTERM resistance, descendants retaining pipes, output overflow, failed supervision (mid-flight worker death), startup SHA snapshot, and preview/valid-confirmation replay refusal with byte-identical queue/cursor/config; verified owned child cleanup and target-ENOENT vs supervisor-failure distinction; inspected shared replay deadline, output bounds and privacy/queue regressions; reran lint/verify/build/focused/full-default/full-controlled with results above; saved detailed report, raw logs and new probe tests under docs/test-reports/BL-REPLAY-PROCESS-BOUNDS-kimi-20261008/. Local macOS acceptance limits truthfully recorded (no native Windows/Linux, no PG16, no browser/original F005, no production gates, no hard-real-time claim for blocked syscalls/suspended OS/escaped groups). No push, no commit, no gate decision written, no real-home/personal access, no product/spec/old-evidence modification.",
      "steps_to_reproduce": "Read docs/test-reports/BL-REPLAY-PROCESS-BOUNDS-kimi-20261008/README.md and the raw logs/probes in that directory; verdict schema .claude/autonomous/verdict-artifact.schema.json; signoff at docs/test-reports/BL-REPLAY-PROCESS-BOUNDS-signoff-2026-10-08.md (release_ready=false). Each probe's exact env -i command line is recorded in the F001-F004 steps_to_reproduce entries."
    }
  ]
}
