{
  "batch_id": "BL-WINDOWS-P1-CHECKOUT-SUPPORT",
  "fix_round": 0,
  "created_at": "2026-10-11T15:58:29Z",
  "waiting": null,
  "verdicts": [
    {
      "feature_id": "F004",
      "result": "PASS",
      "evidence": "OFFLINE supporting evidence only (harness section 1.5 fresh Kimi r1; not native/provenance/Windows/full-release acceptance). HEAD verified 221f2f87d94db1656e3000662796d79621b696f5, parent 54af183617ed06c18edd42632326dbfd09451456. All four declared candidate SHA-256 match exactly: workflow 1ab508fc...83a771, bindings JSON 652a1117...ed1922d, bindings MD fc7f4d09...025ec6, CLI 3028d779...c56e4f6; test file 7718f1e6...289132 unchanged. Byte projections independently re-derived from source888 888a5acd7a8a441c9ec4ad898453f149cf8d6b7c: workflow = one replacement adding exactly four env lines under the checkout step (GIT_CONFIG_COUNT '1' / KEY_0 core.longpaths / VALUE_0 'true', all strings); JSON = exactly the five declared unique replacements (any 4-of-5 partial application does not reproduce the candidate); MD = exact 3011-byte append equal to the proposal appendix; CLI masked for exactly the two identity literals is byte-identical to source888. git diff source888..HEAD touches exactly the 4 candidates + 4 declared plan/pre-scope reports; filtered full ls-tree inventories are identical (frozen 10 hashes, 57-path archive tree, all other tracked records unchanged); scoped source status clean. Fresh owned npm ci exit 0 (670 packages; 7 high severity audit warnings reported honestly; lifecycle download hosts not separately observable; no isolation claim). Unchanged suite run by me: exit 0, 81/81 passed, 14/14 required_future_controls passing (raw/unchanged81.*). npm run verify exit 0 (attempts 2 and 3 failed on MY new test file's typing only - TS2769 missing NODE_ENV, then TS2322 literal widening; immutable logs preserved; corrected to ProcessEnv-annotated literals; attempt 4 and direct npx tsc --noEmit exit 0). Own additive suite tests/evaluator/windows-p1-checkout-r1-20261011.test.ts: 59/59 pass (raw/r1-own-attempt3.*), covering identity/tree closure, byte projections, exact-byte checkout-env confinement oracle with 30 negatives (missing/count0/count2/second-pair/duplicate/extra/nonstring/false; workflow/job/later-step/GITHUB_ENV leakage; config writes/sparse/path/new command/secret/permissions/retry/event/upload mutations), stale/old-source binding rejection via owned-mirror imports of the unchanged CLI (baseline import+validateBindings OK; 5 stale/mutation cases rejected), unchanged systemEnvironment case-insensitive 5-system-key admission discarding all 3 checkout keys, validateProvenance rejection of GIT_CONFIG_* injection/extraEnvironmentKeys/stale source hash, static-labeled guard extra-key closure assertion, and an owned disposable Git fixture proving command-scope-only core.longpaths injection (show-origin 'command line', sibling unset, zero persistence). Full detail: docs/test-reports/BL-WINDOWS-P1-CHECKOUT-kimi-r1-20261011/README.md and raw/.",
      "steps_to_reproduce": "In evaluator worktree at 221f2f87d94db1656e3000662796d79621b696f5: export PATH=/Users/yixingzhou/.nvm/versions/node/v22.22.0/bin:/usr/sbin:/sbin:/usr/bin:/bin HOME=USERPROFILE=/Volumes/ORICO/project/.wp1ce-r1-20261011 TMPDIR=<owned>/tmp npm_config_cache=<owned>/npmcache; npm ci; node node_modules/vitest/vitest.mjs run tests/diagnostics/windows-p1-stages.test.ts --reporter=json --outputFile=<owned>; node node_modules/vitest/vitest.mjs run tests/evaluator/windows-p1-checkout-r1-20261011.test.ts --reporter=json; npm run verify. Hash/projection checks: shasum -a 256 of the five files; git diff --name-only 888a5acd..HEAD; masked CLI comparison via git show 888a5acd:<path>."
    }
  ]
}
