{
  "batch_id": "BL-WINDOWS-P1-PREPARE-OBSERVATION-SUPPORT",
  "fix_round": 0,
  "created_at": "2026-10-11T18:35:41.514Z",
  "waiting": null,
  "verdicts": [
    {
      "feature_id": "F004",
      "result": "PASS",
      "evidence": "OFFLINE supporting only (not native/formal F004/F005/full-release/dependency-security acceptance; original Windows prepare cause remains unknown; no CI/publication authority). Independently recomputed: sole modified CLI docs/test-reports/windows-p1-stages-20261010/p1-stages.mjs sha256 c245a528fb8549915396b5f052bf3841f35b03d88d6b7b5e91982b6f0f07dc4f (pinned match); whole tracked tree vs baseline61 = 1 CLI modification + 9 declared report additions, nothing else; original test sha256 7718f1e6553f1f9bccca0520571727f2a712493ce789bb8a3f0898a75e289132 unchanged. Fresh single npm ci exit 0 in owned env (7 high severity vulnerabilities remain as expected raw warning; package-owned lifecycle scripts incl. better-sqlite3 prebuild-install and Prisma/SWC/esbuild postinstalls logged exit 0 in preserved npmcache/_logs; no no-fallback claim made from exit codes). Unchanged original controls 81/81 passed (exit 0). npm run verify (prisma generate + tsc --noEmit) exit 0 before and after adding own test. Static: 13 fixed 29-byte literals, 51-byte generic, terminal catch max 80 bytes, P00 only in exact --prepare branch, P01-P12 immediately before specified operations, success reset, second sourceFiles pass only split into local before unchanged validateProvenance, both identity literals unchanged, baseline61 recovered byte-exact (whitespace-stripped) after removing permitted slots, no stdout/CR delta. Own additive actual-source-slice VM suite tests/evaluator/windows-p1-prepare-observation-r0-prepare-phase.test.ts 40/40 passed first run: each phase P01-P12 forced synthetic throw -> generic+exact fixed line (80B, exit1, order/count preserved, no canary/getter leak), P10 proves both read passes, success silence/reset, non-prepare/probe/import/guard silence, invalid/unassigned state only P00-as-unknown, privacy with throwing canary getters never read; 14 negative mutants (reorder/after-op/28B/CRLF/CR/duplicate/P13/dynamic/missing-reset/P00-elsewhere/removed-pass2/identity/generic/stdout) all rejected. Full raw logs: docs/test-reports/BL-WINDOWS-P1-PREPARE-OBSERVATION-kimi-r0-20261011/raw/ (npm/oldtest/verify/owntest stdout+stderr+status, npmcache/_logs, static recovery JSON).",
      "steps_to_reproduce": "In worktree at 712cf210b089dc71f3a6e6ed2e19e1de7fee57da with PATH=/Users/yixingzhou/.nvm/versions/node/v22.22.0/bin:/usr/sbin:/sbin:/usr/bin:/bin and owned HOME=USERPROFILE=/Volumes/ORICO/project/.wp1poe-r0-20261011 (TMPDIR+npm cache beneath): 1) shasum -a 256 docs/test-reports/windows-p1-stages-20261010/p1-stages.mjs tests/diagnostics/windows-p1-stages.test.ts; git diff --name-status 61cf64e67a6fda231bb090e77c19d5ececb908af HEAD; 2) npm ci (once); 3) npx vitest run tests/diagnostics/windows-p1-stages.test.ts (expect 81/81); 4) npm run verify (expect exit 0); 5) npx vitest run tests/evaluator/windows-p1-prepare-observation-r0-prepare-phase.test.ts (expect 40/40); 6) node static recovery script -> recovered_equals_baseline_ws_stripped=true (raw/static-verify2.json). See report README for scope limits and npmcache/_logs preservation."
    }
  ]
}
