{
  "batch_id": "BL-WINDOWS-P1-BINDING-IDENTITY-SUPPORT",
  "fix_round": 0,
  "created_at": "2026-10-11T17:15:03Z",
  "waiting": null,
  "verdicts": [
    {
      "feature_id": "F004",
      "result": "PASS",
      "evidence": "OFFLINE supporting acceptance only (harness section 1.5); not native Windows execution, not F004/F005/release acceptance, no CI run or publication performed or authorized. Independent fresh verification at HEAD 61cf64e67a6fda231bb090e77c19d5ececb908af (parent 88d07004466251be3076fc454699207d3879374f, original source 221f2f87d94db1656e3000662796d79621b696f5, clean tree). (1) Exact four-file projection: sha256 match df3fb58c31bfbd50eed0b833926b9389d0e60673e4df905f05d883dcb7892e2e (workflow), f022d586a2968ce67b24512631c7d8ab128d1e85cb483e70934e43d8bfe0a130 (JSON), 9ba4ddf4529c0f4ba89fc79a6378e6614c99e62600eee974dd6d57e4a36a6eeb (MD), 6548ea1cbf7584873f61b4cb396bc9d4ce8567c672d23313b56a38e8ce0d3bae (CLI). Workflow == source221 with ONLY count '1'->'2' + GIT_CONFIG_KEY_1=core.autocrlf/GIT_CONFIG_VALUE_1='false' splice inside the checkout step env (exact five strings, no GITHUB_ENV, no leakage); JSON deep-equal to source221 after stripping exactly the four declared fields (revision 2->3, updated_at_utc 2026-10-11T16:11:16Z, exact C002 revision_scope, exact five-key workflow.checkout_env); MD append-only (old bytes exact prefix, single new section 8 superseding only C001 count1/three-key wording); CLI masking the two new 64hex literals recovers ALL source221 bytes and reverse substitution reproduces HEAD bytes. Old synthetic test sha256 7718f1e6553f1f9bccca0520571727f2a712493ce789bb8a3f0898a75e289132 unchanged; whole-tree diff = exactly those 4 modifications plus 6 declared Planner/pre-scope report additions; native/E0/bounds/selection/cases/tokens/output/schemas/cross_field_invariants/required_future_controls/strict_append/cli_modes/environment/prior_inputs/frozen_runtime_sources deep-equal source221; eleven-path provenance sourceFiles schema (minItems=maxItems=11) unchanged. (2) Fresh own npm ci (Node v22.22.0, owned HOME/USERPROFILE/TMPDIR/npm-cache under /Volumes/ORICO/project/.wp1cbe-r0-20261011): exit 0, added 670 packages; node_modules/braces -> ../vendor/braces and .bin links realpath inside own worktree; vendor/ and package-lock.json byte-unchanged vs source221. Raw warnings disclosed: 7 high severity vulnerabilities (npm audit, NOT fixed per contract), deprecation warnings prebuild-install@7.1.3 and eslint@9.39.5, npm 12.2.0 update notice; Prisma Client v5.22.0 generated. No lock-absent installs were needed; no SWC/wasm fallback observed. (3) Unchanged original controls: vitest tests/diagnostics/windows-p1-stages.test.ts 81/81 passed (15 suites, exit 0); npm run verify (prisma generate && tsc --noEmit) exit 0 both before and after adding own test file. (4) Own 48 additive controls (tests/evaluator/windows-p1-binding-identity-r0-checkout-env.test.ts) all pass: real-candidate exact-byte positives; table-driven rejection of wrong count/value/key, non-string count, missing KEY_1, extra KEY_2, duplicate key, swapped order, old C001 three-key map as stale; workflow/job/later-step/GITHUB_ENV leakage mutants; config-write/secrets/retry/sparse absence + 16 uploads + 6 run commands; JSON stale/one-sided/relabel/weakened-confinement negatives; CLI one-sided/stale/relabel/one-extra-byte negatives; actual unchanged systemEnvironment admits case-insensitive system keys and rejects ALL FIVE checkout keys (ambiguous casing and non-string ProcessEnv values throw); labeled static/pure/mock controls show fixedEnvironment carries no GIT_CONFIG_* keys and guard closes extra keys by exact key-set equality; owned disposable Git fixture (GIT_CONFIG_NOSYSTEM=1, owned empty GIT_CONFIG_GLOBAL, isolated HOME/USERPROFILE/XDG/TMPDIR) shows command-scope five keys preserve raw source JSON bytes, the one-variable autocrlf=true counterfactual yields exactly the LF->CRLF transform (matches the CI-observed-digest explanation class as LOCAL transform evidence only, not a Windows observation), and a sibling run without the keys shows no config persistence. Initial own-test type failures (TS2345/TS2741: this project's ProcessEnv requires NODE_ENV) were preserved in logs and corrected in the own test only; no source relaxation. Raw artifacts: docs/test-reports/BL-WINDOWS-P1-BINDING-IDENTITY-kimi-r0-20261011/ (npm-ci/stdout/stderr, original81.raw.json, npm-verify logs, projection-verify raw+v2, own-tests run1-3 raw json). Unperformed by design: diagnostic CLI prepare/run/probe/seal/verify-upload (forbidden), native Windows run, CI dispatch (Coordinator adjudication), push. Windows INITIAL/original Windows regressions/Compose/provider/encrypted-backup/custody/DB-TCP/password/Agent/homepage/deploy remain open; Compose HARD_STOP and key deferral unchanged.",
      "steps_to_reproduce": "In a fresh worktree at 61cf64e67a6fda231bb090e77c19d5ececb908af: (1) git rev-parse HEAD HEAD^ ; shasum -a 256 the four projected files and tests/diagnostics/windows-p1-stages.test.ts ; git diff --name-status 221f2f87d94db1656e3000662796d79621b696f5 HEAD (expect exactly 4 M + 6 declared A). (2) PATH=/Users/yixingzhou/.nvm/versions/node/v22.22.0/bin:/usr/sbin:/sbin:/usr/bin:/bin HOME=USERPROFILE=/Volumes/ORICO/project/.wp1cbe-r0-20261011 TMPDIR=<owned>/tmp npm_config_cache=<owned>/npm-cache npm ci (exit 0; 670 packages; 7 high vulnerabilities disclosed raw). (3) node node_modules/vitest/vitest.mjs run tests/diagnostics/windows-p1-stages.test.ts --reporter=json (81/81 pass). (4) npm run verify (exit 0). (5) node node_modules/vitest/vitest.mjs run tests/evaluator/windows-p1-binding-identity-r0-checkout-env.test.ts --reporter=json (48/48 pass; includes exact-byte projection oracles, systemEnvironment actual exercise, and owned disposable Git fixture with command-scope five keys and autocrlf counterfactual). (6) Inline byte-projection verifier outputs preserved at docs/test-reports/BL-WINDOWS-P1-BINDING-IDENTITY-kimi-r0-20261011/projection-verify.raw.json and projection-verify-v2.raw.json (v1 had two verifier-script artifacts, corrected and documented in v2, both raw files retained)."
    }
  ]
}
