{
  "batch_id": "BL-HARNESS-DETAIL-MODEINTENT",
  "fix_round": 1,
  "created_at": "2026-07-28T03:49:07Z",
  "waiting": null,
  "verdicts": [
    {
      "feature_id": "F004",
      "result": "PASS",
      "evidence": "Final narrow fix-round re-evaluation at the locked SHA: git rev-parse HEAD returned exactly 4aa801f34b427c7cc6e87d8a85bb2f931722de7f with a clean worktree; dependencies were installed with npm ci --offline (no network). Reviewed the complete diff 698e9a3ccf4babec78f7b1644d0efd17478977c2..HEAD: it touches only src/cli/harness.ts (+16/-1) and tests/cli/harness.test.ts (+20/-1) — no server, UI, migration, framework, or configuration changes. In buildReport (src/cli/harness.ts:146-159) the pending gate is no longer forwarded as the raw local object; it is rebuilt as an explicit nine-key projection — id, kind, batch, from_status, to_status, detail, evidence, raised_at, raised_by — which is exactly the server allowlist enforced by parseGate in app/api/harness/report/route.ts:183-195, where any other key is rejected as unknown_field. The exact live failure is therefore fixed by construction: a gate whose local decision is null is reported without any decision key; arbitrary future/local-only fields are dropped by the projection; and the suppression semantics are preserved — a non-null decision still yields gate:null so a decided gate is never sent (the local stale-copy guard stays intact). Own reruns at the locked SHA: npm test -- --no-cache tests/cli/harness.test.ts tests/server/harness-report-mode-intent.test.ts → 2 test files, 31 passed / 0 failed (16 cli + 15 server), including the new committed assertions that the reported gate deep-equals the nine allowlist fields, carries no decision property, drops an injected local_only field, and that a gate with a populated decision object reports as null; npx eslint src/cli/harness.ts tests/cli/harness.test.ts → exit 0, no output. Inspected as orchestrator/repository evidence and not independently rerun, per contract: npm run verify passed, the full suite reached 49 files / 619 passed / 4 skipped, and npm run build passed — arithmetically consistent with the 618 passed recorded in the r1 signoff plus the one gate-whitelist test this diff adds; and a live local-source harness report returned Reported: 6 with tokenizer absent from the skip list — the same live-check pattern is corroborated in-repo for the prior deploy in progress.json evaluator_feedback, .auto-memory/project-status.md, and docs/test-reports/BL-HARNESS-DETAIL-MODEINTENT-signoff-r1-2026-07-27.md (CI run 30323387595 green). The live report cannot be rerun from this evaluation sandbox because production and network access are contractually out of scope.",
      "steps_to_reproduce": "git checkout 4aa801f34b427c7cc6e87d8a85bb2f931722de7f && npm ci (offline cache suffices). Inspect the fix: git diff 698e9a3ccf4babec78f7b1644d0efd17478977c2..HEAD, then compare the gate projection built in buildReport (src/cli/harness.ts) with the server allowlist in parseGate (app/api/harness/report/route.ts). Rerun the scoped checks: npm test -- --no-cache tests/cli/harness.test.ts tests/server/harness-report-mode-intent.test.ts (expect 2 files, 31 passed — the buildReport describe block covers the exact nine-field body, the local_only drop, and the decided-gate null); npx eslint src/cli/harness.ts tests/cli/harness.test.ts (expect exit 0). Broad checks are evidence-inspection only: progress.json, .auto-memory/project-status.md, docs/test-reports/BL-HARNESS-DETAIL-MODEINTENT-signoff-r1-2026-07-27.md."
    },
    {
      "feature_id": "F006",
      "result": "PASS",
      "evidence": "Final narrow fix-round evaluation executed per contract at the locked SHA 4aa801f34b427c7cc6e87d8a85bb2f931722de7f (git rev-parse HEAD matched exactly, worktree clean). Complete diff review, the allowlist cross-check, and the scoped test/eslint reruns are as recorded in the F004 entry — all green, all independently rerun by this evaluator. The second live report failure (pending_gate present → decision:null forwarded → server unknown_field rejection) is proven fixed end to end at the unit level: the device report now projects only the exact server allowlist fields id, kind, batch, from_status, to_status, detail, evidence, raised_at, raised_by; decision and arbitrary future/local fields cannot leave the device; and a non-null decision still suppresses the gate entirely — 16/16 cli harness tests and 15/15 server report/mode-intent tests pass in my own run, and targeted eslint is clean. The contracted evidence division was honored: I inspected but do not claim to have independently rerun the orchestrator-conveyed broad checks — npm run verify passed, full suite 49 files / 619 passed / 4 skipped, npm run build passed, and the live local-source harness report returning Reported: 6 with tokenizer absent from the skip list; in-repo corroboration of the same live-check pattern from the prior deploy sits in progress.json evaluator_feedback, .auto-memory/project-status.md, and docs/test-reports/BL-HARNESS-DETAIL-MODEINTENT-signoff-r1-2026-07-27.md. Round-0 production-mode Playwright dual-viewport evidence (zero console/page errors, desktop and mobile screenshots retained alongside the signoff docs) remains applicable because this diff touches no UI file. waiting=null — no real adjudication boundary exists; the contract itself prescribes the inspect-only treatment of the heavyweight checks, and every independently verifiable item was verified. This artifact validates against .claude/autonomous/verdict-artifact.schema.json via .claude/autonomous/validate-verdict-artifact.sh.",
      "steps_to_reproduce": "git checkout 4aa801f34b427c7cc6e87d8a85bb2f931722de7f && npm ci. Scoped reruns: npm test -- --no-cache tests/cli/harness.test.ts tests/server/harness-report-mode-intent.test.ts (expect 31 passed) and npx eslint src/cli/harness.ts tests/cli/harness.test.ts (expect exit 0). Evidence inspection without rerun: progress.json (evaluator_feedback, session_notes), .auto-memory/project-status.md, docs/test-reports/BL-HARNESS-DETAIL-MODEINTENT-signoff-r1-2026-07-27.md, docs/test-reports/BL-HARNESS-DETAIL-MODEINTENT-verdict-r1b.json, and the two F006 viewport screenshots under docs/test-reports/. Validate this artifact with .claude/autonomous/validate-verdict-artifact.sh."
    }
  ]
}
