{
  "batch_id": "BL-WINDOWS-P1-PREPARE-OBSERVATION-EVIDENCE-SUPPORT",
  "fix_round": 1,
  "created_at": "2026-10-11T18:52:30Z",
  "waiting": null,
  "verdicts": [
    {
      "feature_id": "F004",
      "result": "PASS",
      "evidence": "PASSIVE evidence/scope supporting only (NOT new functional acceptance, NOT formal F004/F005/native/full-release/dependency-security acceptance; original Windows prepare cause remains unknown; no CI/publication authority granted; Coordinator alone may later decide one new-source non-main CI). Independently recomputed, not from narrative: (1) r0 transport 39/39 destinations byte+sha256 match manifest, sum 1026146; immutable r0 verdict rehashed = e44448af82c920711e24283924ce7ca837b75ffb2dae1659532260b5e264c8de. (2) Generator/post-scope 49/49 originals match manifest AND committed blobs afcb169/6bae786, sum 1225388. (3) Planner 7/7 + pre-scope 2/2 originals match manifests and blobs 22946b3/27dd6bc (952f0b04/f96f8ca7 pins). (4) MAIN: candidate docs/test-reports/windows-p1-stages-20261010/p1-stages.mjs at source712 = 74301B sha256 c245a528fb8549915396b5f052bf3841f35b03d88d6b7b5e91982b6f0f07dc4f; own read-only reversible transform removed ONLY the 20 commissioned slots (module state block incl. 13 fixed 29B literals, P01-P12 assignments, success reset, 4 rejoins reversing statement/local split incl. prepareSourceFiles re-inline, P00 dispatch activation, 2-line terminal catch), each asserted exactly-once; output 73022B sha256 6548ea1cbf7584873f61b4cb396bc9d4ce8567c672d23313b56a38e8ce0d3bae Buffer-EXACT equals baseline61 blob, zero residual tokens, NO whitespace normalization (supersedes r0 ws-stripped-only recovery). (5) Tree records: 712cf21 touches 1 path mode 100644->100644; 61cf64e..712cf21 = 1 modification + 9 declared report additions; original test blob 7718f1e6553f1f9bccca0520571727f2a712493ce789bb8a3f0898a75e289132 identical both commits. (6) SWC: npm-debug 2026-10-11T18_19_59_609Z proves package-owned @swc/core@1.16.13 postinstall (postinstall.js:125) npm install --no-save @swc/wasm@1.16.13, registry GET 200 x2, cwd node_modules/@swc/core/npm-install, exit 0; installed wasm 1.16.13 ABSENT from installed lock and committed package-lock.json; 7 high vulnerabilities remain; neither no-fallback nor all-lock-only nor native/security acceptance sustainable. (7) r0 receipts exit0/1294s/process_exit/COMPLETED; own40 40/40, original81 81/81, verify x2, npm ci exit0 (670 pkgs) confirmed from status/stdout originals. Static vs runtime: emission/privacy/silence controls are VM-synthetic (r0 own suite) + static byte controls; original81 is baseline-behavior runtime; NO real-process/real-Windows emission evidence exists anywhere; narrow offline support is sufficient for the scoped purpose only. r0 deviations confirmed from retained originals, not softened/not retro-authorized: two cat-authored HOME analyst scripts + own-HOME apply_patch probe (9B probe-ok); initial static false checks (map_has_exactly_13:false, recovered:false, leftover_refs:1) corrected to ws-stripped true with block_removed:false; retrospective README timeline, receipt1294s authoritative. Raw machine captures + own transform: docs/test-reports/BL-WINDOWS-P1-PREPARE-OBSERVATION-evidence-kimi-r1-20261011/ (README.md, analyst-transform.mjs, raw/ 7 captures). release_ready=false; frozen surfaces unchanged; keys deferred.",
      "steps_to_reproduce": "Read-only, Node v22.22.0 (/Users/yixingzhou/.nvm/versions/node/v22.22.0/bin/node) + git/shasum only: 1) node -e hash-compare of windows-prepare-observation-kimi-r0-transport-manifest.json 39 entries under coordination worktree -> raw/r0-transport-39-verify.txt (39 OK, 0 mismatch); shasum -a 256 of BL-WINDOWS-P1-PREPARE-OBSERVATION-SUPPORT-verdict.json -> e44448af.... 2) same for windows-prepare-observation-generator-and-postscope-transport-manifest.json 49 entries plus git -C <source712 worktree> show afcb169:<path> / 6bae786:<path> blob rehash -> raw/generator-postscope-49-verify.txt (49 OK). 3) rehash 7 planner + 2 pre-scope files vs blobs 22946b3/27dd6bc -> raw/planner-prescope-originals-verify.txt (9 OK). 4) node docs/test-reports/BL-WINDOWS-P1-PREPARE-OBSERVATION-evidence-kimi-r1-20261011/analyst-transform.mjs -> raw/analyst-transform-result.json: output_equals_baseline61_buffer=true, 73022B, sha256 6548ea1c..., residual tokens [], whitespace_normalization_used=false. 5) git show --raw 712cf21 + git diff --name-status 61cf64e..712cf21 + git status --short -> raw/git-tree-records.txt (1 modified path, mode unchanged, clean). 6) git show <commit>:tests/diagnostics/windows-p1-stages.test.ts | shasum for both commits -> identical 7718f1e6.... 7) grep/node inspection of npmcache-logs/2026-10-11T18_19_59_609Z-debug-0.log, swc-core/wasm package originals, postinstall original, installed-lock original, committed package-lock.json -> raw/swc-fallback-audit.txt. 8) cat r0 raw status/stdout/static-verify originals + run-meta/receipt/validation -> raw/r0-controls-and-receipts-audit.txt. No target import/VM/test/install/network execution performed at any step."
    }
  ]
}
